{
  "$schema": "https://json-schema.org/draft/2020-12/schema",
  "$id": "stewardmd/kb/reference.schema.json",
  "title": "StewardMD Reference-only Disease (knowledge object)",
  "description": "Reference-ONLY disease knowledge (kb/reference/*.json). Unlike a diagnostic disease it has NO matching/scoring block and NO treatment file — it exists purely as cited, RAG-retrievable knowledge. Paraphrased from a standard textbook (Harrison for internal medicine; Nelson for paediatrics; Parsons/Kanski for ophthalmology; etc.), page-cited, never verbatim. The knowledge block lives under `harrison` (internal-medicine, legacy key) OR the source-neutral `reference` key — at least one is required, and its inner `source` names the actual textbook. A reference disease may later be PROMOTED to the diagnostic tier by adding a matching block and moving it to kb/diseases/ (Phase-2 work).",
  "type": "object",
  "additionalProperties": false,
  "required": ["id", "name", "class", "referenceOnly", "review"],
  "properties": {
    "id": { "type": "string", "description": "Stable disease key (lower_snake or SCREAMING form, matching the diagnostic-tier convention)." },
    "name": { "type": "string" },
    "aliases": { "type": "array", "items": { "type": "string" }, "description": "Synonyms / lay terms — used for retrieval." },
    "class": { "type": "string", "enum": ["infective", "non_infective"] },
    "system": { "type": "string", "description": "Organ system / specialty (free text; mapped to a specialty by the coverage/specialty regex)." },
    "specialty": { "type": "string", "description": "Optional explicit specialty tag (e.g. 'Paediatrics', 'Ophthalmology') for new non-IM domains." },
    "chapter": { "type": ["integer", "null"], "description": "Source chapter number (nullable)." },
    "page": { "type": ["integer", "null"], "description": "Source page anchor (nullable)." },
    "referenceOnly": { "const": true, "description": "MUST be true — this is what distinguishes a reference entry from a diagnostic disease." },
    "harrison": { "$ref": "#/$defs/knowledgeBlock", "description": "Internal-medicine reference knowledge (Harrison). Legacy key; use `reference` for non-IM sources." },
    "reference": { "$ref": "#/$defs/knowledgeBlock", "description": "Source-neutral reference knowledge block (use for Nelson paediatrics, Parsons/Kanski ophthalmology, etc.). Same shape as `harrison`; the inner `source` names the textbook." },
    "review": {
      "type": "object", "additionalProperties": false, "required": ["status"],
      "properties": {
        "status": { "type": "string", "enum": ["draft", "ai_drafted", "in_review", "approved", "deprecated"] },
        "reviewedBy": { "type": ["string", "null"] },
        "reviewedAt": { "type": ["string", "null"] },
        "clinicianApproved": { "type": "boolean" }
      }
    },
    "version": { "type": "integer", "minimum": 1 },
    "algorithms": { "type": "array", "items": { "type": "object" } },
    "tables": { "type": "array", "items": { "type": "object" } },
    "diagrams": { "type": "array", "items": { "type": "object" } },
    "citations": { "type": "array", "items": { "type": "object" } },
    "valueTables": { "type": "array", "items": { "type": "object" } },
    "flowcharts": { "type": "array", "items": { "type": "object" } },
    "figures": { "type": "array", "items": { "type": "object" } }
  },
  "$defs": {
    "knowledgeBlock": {
      "type": "object", "additionalProperties": false,
      "description": "Paraphrased reference knowledge (page-cited, not verbatim). `source` names the actual textbook/edition.",
      "properties": {
        "source": { "type": "string" }, "sourceEdition": { "type": "string" }, "pages": { "type": ["string", "null"] },
        "clinicalPearls": { "type": "array", "items": { "type": "string" } },
        "pathophysiology": { "type": ["string", "null"] },
        "additionalDifferentials": { "type": "array", "items": { "type": "string" } },
        "infectionMimics": { "type": "array", "items": { "type": "string" } },
        "nonInfectiousMimics": { "type": "array", "items": { "type": "string" } },
        "additionalInvestigations": { "type": "array", "items": { "type": "string" } },
        "redFlags": { "type": "array", "items": { "type": "string" } },
        "prognosis": { "type": ["string", "null"] },
        "pitfalls": { "type": "array", "items": { "type": "string" } },
        "management": { "type": "array", "items": { "type": "string" }, "description": "AI-drafted, dose-free management pillars (definitive/supportive/monitoring/complications/escalation). Decision-support only; not clinician-verified." },
        "severityClassification": { "type": ["string", "null"] },
        "references": { "type": "array", "items": { "type": "string" } },
        "crossLinks": { "type": "array", "items": { "type": "string" }, "description": "Related KB disease ids." },
        "conflicts": { "type": "array", "items": { "type": "object" } },
        "importedAt": { "type": ["string", "null"] }, "contentHash": { "type": ["string", "null"] }
      }
    }
  }
}
