{
 "id": "portal_cavernoma",
 "name": "portal cavernoma",
 "aliases": [
  "cavernous transformation of the portal vein",
  "portal vein cavernoma"
 ],
 "class": "non_infective",
 "system": "hepatobiliary",
 "specialty": "hepatology",
 "referenceOnly": true,
 "reference": {
  "source": "Sherlock's Diseases of the Liver and Biliary System",
  "sourceEdition": "current",
  "pages": null,
  "clinicalPearls": [
   "A portal cavernoma is the network of hepatopetal collateral veins that develops around a chronically obstructed or thrombosed portal vein, a process termed cavernous transformation.",
   "It is the hallmark of chronic extrahepatic portal vein obstruction, and in the absence of cirrhosis liver synthetic function is typically well preserved.",
   "In children it commonly follows neonatal umbilical vein catheterisation, omphalitis or sepsis, whereas in adults prothrombotic states, myeloproliferative neoplasms, cirrhosis, abdominal sepsis and malignancy predominate.",
   "The dominant clinical problem is portal hypertension with gastro-oesophageal varices, splenomegaly and hypersplenism.",
   "Variceal bleeding is often surprisingly well tolerated because hepatic function is preserved.",
   "The collaterals can compress the biliary tree to produce portal cavernoma cholangiopathy, also called portal biliopathy.",
   "Doppler ultrasound shows the serpiginous collaterals replacing the normal portal vein, and CT or MR portography maps the anatomy for intervention.",
   "The Meso-Rex bypass, which restores physiological portal inflow, is the preferred operation in suitable children."
  ],
  "pathophysiology": "When the main portal vein is obstructed by thrombosis, extrinsic compression or malformation, the portal circulation seeks alternative routes to reach the liver. Over weeks to months the pre-existing tiny peribiliary and paracholedochal veins in the porta hepatis dilate and proliferate into a leash of tortuous hepatopetal collaterals, the cavernoma, which partially bypasses the occluded segment. Because these collaterals cannot fully substitute for the calibre of the native vein, portal pressure rises and drives the formation of portosystemic collaterals including gastro-oesophageal varices, together with splenomegaly and hypersplenism. In extrahepatic obstruction the intrahepatic parenchyma and its arterial supply remain intact, so hepatic synthetic function is generally preserved and bleeding is better tolerated than in cirrhotic portal hypertension. The engorged periductal collaterals may in turn compress and distort the bile ducts, producing cholangiopathy.",
  "additionalDifferentials": [
   "Cirrhotic portal hypertension",
   "Non-cirrhotic portal fibrosis or idiopathic portal hypertension",
   "Budd-Chiari syndrome",
   "Portal vein tumour thrombus from hepatocellular carcinoma",
   "Congenital hepatic fibrosis",
   "Arterioportal fistula",
   "Hepatic schistosomiasis"
  ],
  "additionalInvestigations": [
   "Doppler ultrasound of the portal system",
   "CT or MR portography",
   "Upper gastrointestinal endoscopy for varices",
   "Thrombophilia and myeloproliferative neoplasm screen including JAK2 mutation testing",
   "Full blood count to assess hypersplenism",
   "Liver function and synthetic tests to confirm preserved function",
   "MRCP if biliopathy is suspected"
  ],
  "redFlags": [
   "Acute variceal haemorrhage with haematemesis or melaena",
   "Ascending cholangitis from associated biliopathy",
   "Extension of thrombosis into the mesenteric veins with bowel ischaemia",
   "Rapid splenic enlargement with severe cytopenias"
  ],
  "prognosis": "With preserved hepatic function the long-term outlook is generally good once varices are controlled, though recurrent bleeding, hypersplenism and biliopathy contribute to morbidity, and extension of thrombosis to the mesenteric veins is a serious threat.",
  "pitfalls": [
   "Assuming portal hypertension implies cirrhosis and overlooking a non-cirrhotic cavernoma with preserved liver function.",
   "Failing to screen for and treat an underlying prothrombotic or myeloproliferative disorder.",
   "Missing associated portal biliopathy as a cause of cholestasis.",
   "Delaying recognition of mesenteric extension causing intestinal ischaemia."
  ],
  "references": [
   "Sherlock's Diseases of the Liver and Biliary System",
   "Baveno consensus on portal hypertension",
   "Sleisenger and Fordtran's Gastrointestinal and Liver Disease"
  ],
  "crossLinks": [],
  "management": [
   "Anticoagulation directed by the underlying prothrombotic state, balanced against variceal bleeding risk after endoscopic assessment",
   "Prevention and treatment of gastro-oesophageal variceal bleeding with endoscopic band ligation and non-selective beta-blockade, and surveillance endoscopy",
   "Meso-Rex bypass, restoring physiological portal flow, or a portosystemic shunt for refractory variceal bleeding or symptomatic portal hypertension, particularly in children",
   "Management of hypersplenism and its cytopenias, with attention to bleeding risk",
   "Treatment of coexisting portal cavernoma cholangiopathy when biliary obstruction develops",
   "Haematology referral to identify and treat an underlying myeloproliferative neoplasm or thrombophilia, with monitoring for extension of thrombosis into the mesenteric veins"
  ]
 },
 "review": {
  "status": "ai_drafted",
  "reviewedBy": null,
  "reviewedAt": null,
  "clinicianApproved": false
 },
 "version": 1,
 "algorithms": [
  {
   "id": "portal_cavernoma-pathway",
   "title": "portal cavernoma: Clinical Decision & Diagnostic Pathway",
   "steps": [
    {
     "step": "Clinical Presentation & High Suspicion",
     "action": "A portal cavernoma is the network of hepatopetal collateral veins that develops around a chronically obstructed or thrombosed portal vein, a process termed cavernous transformation.",
     "critical": true
    },
    {
     "step": "Triage & Emergency Warning Signs",
     "branch": "Critical Findings",
     "action": "Emergency red flag evaluation: Acute variceal haemorrhage with haematemesis or melaena",
     "critical": true
    },
    {
     "step": "Diagnostic Workup & Biomarkers",
     "action": "Targeted workup: Doppler ultrasound of the portal system, CT or MR portography, Upper gastrointestinal endoscopy for varices"
    },
    {
     "step": "Targeted Clinical Management",
     "branch": "Treatment Pathway",
     "action": "Targeted management: Anticoagulation directed by the underlying prothrombotic state, balanced against variceal bleeding risk after endoscopic assessment"
    },
    {
     "step": "Monitoring & Critical Pitfalls",
     "action": "Clinical pitfall alert: Assuming portal hypertension implies cirrhosis and overlooking a non-cirrhotic cavernoma with preserved liver function."
    }
   ],
   "caption": "Clinical pathway for the evaluation and management of portal cavernoma."
  }
 ],
 "tables": [
  {
   "id": "portal_cavernoma-matrix",
   "title": "portal cavernoma: Clinical Features & Management Matrix",
   "headers": [
    "Clinical Domain",
    "Protocol Recommendation",
    "Operational Goal"
   ],
   "rows": [
    [
     "Diagnostic Hallmark",
     "A portal cavernoma is the network of hepatopetal collateral veins that develops around a chronically obstructed or thrombosed",
     "Cardinal clinical findings"
    ],
    [
     "Key Investigations",
     "Doppler ultrasound of the portal system, CT or MR portography, Upper gastrointestinal endoscopy for varices",
     "Confirmatory diagnostic workup"
    ],
    [
     "Primary Differentials",
     "Cirrhotic portal hypertension, Non-cirrhotic portal fibrosis or idiopathic portal hypertension, Budd-Chiari syndrome",
     "Rule out key mimics"
    ],
    [
     "Management Strategy",
     "Anticoagulation directed by the underlying prothrombotic state, balanced against variceal bleeding risk after endoscopic",
     "Core treatment modality"
    ],
    [
     "Clinical Pitfall",
     "Assuming portal hypertension implies cirrhosis and overlooking a non-cirrhotic cavernoma with preserved liver function.",
     "Prevent diagnostic or management error"
    ]
   ],
   "caption": "Overview comparison matrix for portal cavernoma."
  }
 ]
}
