{
  "id": "lung_cancer_nodule_long_case",
  "name": "Lung Cancer Nodule Long Case",
  "aliases": [
    "Smoker weight clubbing haemoptysis",
    "Pancoast Horner SVC stridor",
    "CT biopsy staging MDT",
    "Smoking quit screening LDCT"
  ],
  "class": "non_infective",
  "system": "Medicine",
  "specialty": "Respiratory",
  "referenceOnly": true,
  "review": {
    "status": "ai_drafted"
  },
  "reference": {
    "source": "Long Cases in Clinical Medicine (topic map; text rewritten, no verbatim copy)",
    "sourceEdition": "topic map (2026-10-14)",
    "pages": null,
    "clinicalPearls": [
      "Pack-years clubbing pace",
      "Pancoast SVC stridor",
      "TNM PET EBUS MDT",
      "Stents steroids fluids isolate"
    ],
    "pathophysiology": "Smokers weighting streaking while paces count profiling; clubbings wasting swelling while dips fix staging, and spiculates sampling staging while wastes clear haloing, with resects doubling burning while blocks press climbing.",
    "additionalDifferentials": [
      "Cancer versus TB versus pneumonia by course and AFB",
      "SCLC versus NSCLC by spread and markers",
      "Pancoast versus cervical by Horner and wasting"
    ],
    "additionalInvestigations": [
      "CT with biopsy TNM PET",
      "PFT with EBUS markers LDCT",
      "Smoking pack with MDT palliation plan"
    ]
  }
}
