{
 "id": "vocal_cord_paralysis_ent",
 "name": "Vocal Cord Paralysis",
 "aliases": [
  "Recurrent laryngeal nerve",
  "Vocal cord palsy causes",
  "Thyroplasty",
  "Bilateral cord palsy airway"
 ],
 "class": "non_infective",
 "system": "ENT",
 "specialty": "ENT",
 "referenceOnly": true,
 "review": {
  "status": "ai_drafted"
 },
 "reference": {
  "source": "Dhingra Diseases of ENT 8th Edition (topic map; text rewritten, no verbatim copy)",
  "sourceEdition": "8th edition topic map (2026-10-13)",
  "pages": null,
  "clinicalPearls": [
   "Left recurrent nerve longer: left palsy commoner",
   "Image skull base to aortopulmonary window in idiopathic palsy",
   "Ortner syndrome is cardiac left cord palsy",
   "Bilateral palsy: voice okay, airway threatened"
  ],
  "pathophysiology": "Posterior cricoarytenoid sole abductor failure closes glottis in bilateral recurrent lesions, while high vagal injury adds pharyngeal and palatal paralysis compounding aspiration beyond cord gap.",
  "additionalDifferentials": [
   "Arytenoid dislocation versus nerve palsy (trauma, palpation mobility)",
   "Unilateral versus bilateral palsy priorities (voice versus airway)",
   "Superior versus recurrent laryngeal injury after thyroidectomy"
  ],
  "additionalInvestigations": [
   "Flexible laryngoscopy with stroboscopy",
   "CT skull base to mediastinum for unexplained palsy",
   "Swallow assessment (FEES) for aspiration grading"
  ]
 }
}