{
  "id": "hypothyroidism_hashimoto_myxoedema_long_case",
  "name": "Hypothyroidism Hashimoto Myxoedema Long Case",
  "aliases": [
    "Cold dry hair constipation menorrhagia",
    "Delayed reflex goitre TPO Hashimoto",
    "Puffy hoarse myxoedema coma trigger",
    "Levothyroxine empty TSH coma warm"
  ],
  "class": "non_infective",
  "system": "Medicine",
  "specialty": "Endocrinology",
  "referenceOnly": true,
  "review": {
    "status": "ai_drafted"
  },
  "reference": {
    "source": "Long Cases in Clinical Medicine (topic map; text rewritten, no verbatim copy)",
    "sourceEdition": "topic map (2026-10-14)",
    "pages": null,
    "clinicalPearls": [
      "Cold TSH TPO levothyroxine",
      "Puffy delayed coma cortisol-first",
      "Hashimoto ablative iodine drug central",
      "Empty elderly ICU precipitate follow"
    ],
    "pathophysiology": "Autoimmune Hashimoto destroys follicles while ablation iodine drugs and central disease remove hormone; falling T4 slows every tissue producing cold dry bradycardic constipation, and precipitants tip the fragile compensated state into myxoedema coma.",
    "additionalDifferentials": [
      "Hashimoto versus ablative versus iodine versus drugs by TPO scar and endemic",
      "Primary versus central by TSH direction",
      "Myxoedema versus sepsis by hypothermia and TSH"
    ],
    "additionalInvestigations": [
      "TSH FT4 with TPO lipids ECG",
      "Cortisol synacthen with pituitary MRI in coma",
      "Endocrine with precipitant hunt"
    ]
  }
}
