{
 "id": "necrotising_sialometaplasia",
 "name": "Necrotising sialometaplasia",
 "aliases": [
  "necrotizing sialometaplasia"
 ],
 "class": "non_infective",
 "system": "Oral cavity / Salivary glands",
 "specialty": "Oral medicine / Oral and maxillofacial surgery",
 "referenceOnly": true,
 "reference": {
  "source": "Oral pathology reference texts",
  "sourceEdition": "current",
  "pages": null,
  "clinicalPearls": [
   "A benign, self-limiting inflammatory condition of minor salivary glands that clinically and histologically mimics malignancy",
   "It most often presents as a sudden crater-like ulcer of the hard palate, sometimes bilateral",
   "The lesion is important chiefly because it can be mistaken for squamous cell carcinoma or a salivary malignancy",
   "Preceding local ischaemic insults such as trauma, injection, surgery or smoking are commonly identified",
   "Histology shows lobular necrosis with squamous metaplasia of ducts while preserving the lobular architecture",
   "Recognition avoids unnecessary radical surgery, as the lesion heals spontaneously over weeks"
  ],
  "pathophysiology": "Necrotising sialometaplasia is thought to result from ischaemic injury to the minor salivary glands, most often in the palate, following vascular compromise from trauma, local anaesthetic injection, surgery, pressure or smoking. The ischaemia causes acinar necrosis, and reparative squamous metaplasia of the salivary ducts follows. This combination of necrosis and metaplasia can closely resemble malignancy both clinically and microscopically, but the preserved lobular architecture indicates a benign reactive process.",
  "additionalDifferentials": [
   "Squamous cell carcinoma",
   "Mucoepidermoid carcinoma or other salivary malignancy",
   "Traumatic ulcer",
   "Deep fungal or other infective ulcer",
   "Ulceration from vasculitis or other systemic disease"
  ],
  "additionalInvestigations": [
   "Incisional biopsy with experienced histopathological assessment",
   "History of preceding local trauma, injection or surgery",
   "Clinical follow-up to confirm spontaneous healing",
   "Exclusion of malignancy and infective causes on histology"
  ],
  "redFlags": [
   "Failure to heal within the expected weeks",
   "Histological features favouring malignancy on expert review",
   "Progressive enlargement or induration",
   "Associated systemic features suggesting another cause"
  ],
  "prognosis": "The condition is benign and self-limiting, healing spontaneously over several weeks without specific treatment.",
  "pitfalls": [
   "Misinterpreting the clinical or histological picture as carcinoma and performing radical surgery",
   "Failing to obtain expert histopathology review",
   "Overlooking a preceding ischaemic insult in the history",
   "Not arranging follow-up to confirm healing"
  ],
  "references": [
   "Oral pathology reference texts (standard reference)",
   "Oral and maxillofacial surgery reference texts (standard reference)"
  ],
  "crossLinks": [],
  "management": [
   "Reassurance and conservative management, as the lesion heals spontaneously over several weeks without specific treatment",
   "Incisional biopsy with experienced histopathological review to exclude squamous cell carcinoma or salivary malignancy and avoid unnecessary radical surgery",
   "Symptomatic care with analgesia, gentle oral hygiene and saline mouth rinses while the ulcer heals",
   "Identification and removal of precipitating factors such as local trauma and smoking",
   "Clinical follow-up to confirm spontaneous resolution",
   "Referral to oral medicine or oral and maxillofacial surgery for diagnosis"
  ]
 },
 "review": {
  "status": "ai_drafted",
  "reviewedBy": null,
  "reviewedAt": null,
  "clinicianApproved": false
 },
 "version": 1,
 "algorithms": [
  {
   "id": "necrotising_sialometaplasia-pathway",
   "title": "Necrotising sialometaplasia: Clinical Decision & Diagnostic Pathway",
   "steps": [
    {
     "step": "Clinical Presentation & High Suspicion",
     "action": "A benign, self-limiting inflammatory condition of minor salivary glands that clinically and histologically mimics malignancy",
     "critical": true
    },
    {
     "step": "Triage & Emergency Warning Signs",
     "branch": "Critical Findings",
     "action": "Emergency red flag evaluation: Failure to heal within the expected weeks",
     "critical": true
    },
    {
     "step": "Diagnostic Workup & Biomarkers",
     "action": "Targeted workup: Incisional biopsy with experienced histopathological assessment, History of preceding local trauma, injection or surgery, Clinical follow-up to confirm spontaneous healing"
    },
    {
     "step": "Targeted Clinical Management",
     "branch": "Treatment Pathway",
     "action": "Targeted management: Reassurance and conservative management, as the lesion heals spontaneously over several weeks without specific treatment"
    },
    {
     "step": "Monitoring & Critical Pitfalls",
     "action": "Clinical pitfall alert: Misinterpreting the clinical or histological picture as carcinoma and performing radical surgery"
    }
   ],
   "caption": "Clinical pathway for the evaluation and management of necrotising sialometaplasia."
  }
 ],
 "tables": [
  {
   "id": "necrotising_sialometaplasia-matrix",
   "title": "Necrotising sialometaplasia: Clinical Features & Management Matrix",
   "headers": [
    "Clinical Domain",
    "Protocol Recommendation",
    "Operational Goal"
   ],
   "rows": [
    [
     "Diagnostic Hallmark",
     "A benign, self-limiting inflammatory condition of minor salivary glands that clinically and histologically mimics malignancy",
     "Cardinal clinical findings"
    ],
    [
     "Key Investigations",
     "Incisional biopsy with experienced histopathological assessment, History of preceding local trauma, injection or surgery,",
     "Confirmatory diagnostic workup"
    ],
    [
     "Primary Differentials",
     "Squamous cell carcinoma, Mucoepidermoid carcinoma or other salivary malignancy, Traumatic ulcer",
     "Rule out key mimics"
    ],
    [
     "Management Strategy",
     "Reassurance and conservative management, as the lesion heals spontaneously over several weeks without specific treatment",
     "Core treatment modality"
    ],
    [
     "Clinical Pitfall",
     "Misinterpreting the clinical or histological picture as carcinoma and performing radical surgery",
     "Prevent diagnostic or management error"
    ]
   ],
   "caption": "Overview comparison matrix for necrotising sialometaplasia."
  }
 ],
 "diagrams": [
  {
   "id": "necrotising-sialometaplasia-real-image",
   "title": "Necrotising sialometaplasia: Diagnostic Imaging Evaluation",
   "type": "xray",
   "src": "/assets/kb-real-images/normal-chest-xray.jpg?v=kbri1",
   "caption": "Standard diagnostic imaging examination displaying cardiopulmonary silhouette, anatomical landmarks, and visceral boundaries.",
   "annotations": [
    {
     "label": "Cardiothoracic Ratio",
     "description": "Heart size, mediastinal width, and great vessel contours."
    },
    {
     "label": "Visceral Fields",
     "description": "Parenchymal lucency, vascular distribution, and baseline symmetry."
    },
    {
     "label": "Bony Thorax & Soft Tissues",
     "description": "Costal contours, diaphragmatic arches, and soft tissue boundaries."
    }
   ]
  }
 ]
}
