{
 "id": "horseshoe_kidney",
 "name": "Horseshoe kidney",
 "aliases": [
  "renal fusion anomaly",
  "horseshoe kidney anomaly",
  "ren arcuatus"
 ],
 "class": "non_infective",
 "system": "Renal / Urology",
 "specialty": "Urology",
 "referenceOnly": true,
 "reference": {
  "source": "Campbell-Walsh-Wein Urology",
  "sourceEdition": "current",
  "pages": null,
  "clinicalPearls": [
   "The commonest renal fusion anomaly, in which the two kidneys are joined, most often at their lower poles, by an isthmus of renal parenchyma or fibrous tissue crossing the midline",
   "The isthmus is typically arrested beneath the inferior mesenteric artery during ascent, so the kidney sits lower than normal and its collecting systems and vessels are anomalous",
   "Often asymptomatic and found incidentally, but there is an increased risk of ureteropelvic junction obstruction, stone formation, and infection because of high ureteric insertion and impaired drainage",
   "Associated with an increased incidence of certain malignancies, including Wilms tumour in children and, in adults, renal and transitional cell tumours, as well as a reported association with retroperitoneal sarcoma of the isthmus",
   "The blood supply is highly variable, often with multiple accessory arteries, which is important before any surgery",
   "May be associated with other anomalies and syndromes, including Turner syndrome and trisomy 18",
   "Management is directed at complications such as obstruction (pyeloplasty), stones, or tumour; the anomaly itself needs no treatment when asymptomatic"
  ],
  "pathophysiology": "A horseshoe kidney forms during early development when the two metanephric masses fuse across the midline, usually at their lower poles, before normal ascent and rotation are complete. As the fused kidney ascends it is halted by the inferior mesenteric artery catching the isthmus, so the kidney remains low and incompletely rotated, with anteriorly directed pelves and high ureteric insertions. These anatomical features impair urinary drainage and predispose to ureteropelvic junction obstruction, stasis, calculus formation, and infection. The variable and often multiple vascular supply reflects the abnormal position and developmental history of the fused kidney.",
  "additionalDifferentials": [
   "Crossed fused renal ectopia",
   "Pelvic or ectopic kidney",
   "Bilateral ureteropelvic junction obstruction of normally positioned kidneys",
   "Retroperitoneal mass mimicking an isthmus",
   "Malrotated kidney without fusion",
   "Nephroptosis"
  ],
  "additionalInvestigations": [
   "Renal ultrasound to identify the isthmus and hydronephrosis",
   "CT or MR urography to define anatomy, vasculature, and any obstruction or tumour",
   "MAG3 diuretic renogram to assess drainage and differential function",
   "Non-contrast CT for suspected calculi",
   "Micturating cystourethrogram (MCUG) if reflux is suspected",
   "Urinalysis and culture during infection"
  ],
  "redFlags": [
   "Symptomatic ureteropelvic junction obstruction with pain or declining function",
   "Recurrent or obstructing calculi with infection",
   "A solid mass arising from the isthmus or a renal moiety suggesting malignancy",
   "Urosepsis in an obstructed system"
  ],
  "prognosis": "Most horseshoe kidneys are asymptomatic and compatible with normal life expectancy; prognosis worsens only when complications such as obstruction, recurrent stones, infection, or tumour arise, and these are generally manageable with targeted treatment.",
  "pitfalls": [
   "Failing to map the anomalous and often multiple vessels before surgery on the isthmus or a renal unit",
   "Missing an isthmic tumour by not imaging the parenchyma crossing the midline",
   "Attributing all flank pain to the anomaly and overlooking a treatable obstruction or stone",
   "Overlooking associated syndromic conditions in children"
  ],
  "references": [
   "Campbell-Walsh-Wein Urology",
   "Smith's General Urology (Smith & Tanagho)"
  ],
  "crossLinks": [],
  "management": [
   "Manage asymptomatic incidental cases conservatively with reassurance and periodic surveillance",
   "Relieve ureteropelvic junction obstruction surgically with pyeloplasty when symptomatic or causing deteriorating drainage or function",
   "Treat calculi with appropriate lithotripsy, ureteroscopy or percutaneous techniques, allowing for the abnormal anatomy and impaired drainage",
   "Treat urinary tract infections promptly with culture-directed antibiotics and address predisposing stasis and reflux",
   "Define the variable, often multiple arterial supply with CT or MR angiography before any surgery",
   "Maintain surveillance for the increased tumour risk, including Wilms tumour in children and renal and transitional cell tumours in adults",
   "Refer to urology and screen for associated anomalies and syndromes such as Turner syndrome and trisomy 18"
  ]
 },
 "review": {
  "status": "ai_drafted",
  "reviewedBy": null,
  "reviewedAt": null,
  "clinicianApproved": false
 },
 "version": 1,
 "algorithms": [
  {
   "id": "horseshoe_kidney-pathway",
   "title": "Horseshoe kidney: Clinical Decision & Diagnostic Pathway",
   "steps": [
    {
     "step": "Clinical Presentation & High Suspicion",
     "action": "The commonest renal fusion anomaly, in which the two kidneys are joined, most often at their lower poles, by an isthmus of renal parenchyma or fibrous tissue crossing the midline",
     "critical": true
    },
    {
     "step": "Triage & Emergency Warning Signs",
     "branch": "Critical Findings",
     "action": "Emergency red flag evaluation: Symptomatic ureteropelvic junction obstruction with pain or declining function",
     "critical": true
    },
    {
     "step": "Diagnostic Workup & Biomarkers",
     "action": "Targeted workup: Renal ultrasound to identify the isthmus and hydronephrosis, CT or MR urography to define anatomy, vasculature, and any obstruction or tumour, MAG3 diuretic renogram to assess drainage and differential function"
    },
    {
     "step": "Targeted Clinical Management",
     "branch": "Treatment Pathway",
     "action": "Targeted management: Manage asymptomatic incidental cases conservatively with reassurance and periodic surveillance"
    },
    {
     "step": "Monitoring & Critical Pitfalls",
     "action": "Clinical pitfall alert: Failing to map the anomalous and often multiple vessels before surgery on the isthmus or a renal unit"
    }
   ],
   "caption": "Clinical pathway for the evaluation and management of horseshoe kidney."
  }
 ],
 "tables": [
  {
   "id": "horseshoe_kidney-matrix",
   "title": "Horseshoe kidney: Clinical Features & Management Matrix",
   "headers": [
    "Clinical Domain",
    "Protocol Recommendation",
    "Operational Goal"
   ],
   "rows": [
    [
     "Diagnostic Hallmark",
     "The commonest renal fusion anomaly, in which the two kidneys are joined, most often at their lower poles, by an isthmus of renal",
     "Cardinal clinical findings"
    ],
    [
     "Key Investigations",
     "Renal ultrasound to identify the isthmus and hydronephrosis, CT or MR urography to define anatomy, vasculature, and any",
     "Confirmatory diagnostic workup"
    ],
    [
     "Primary Differentials",
     "Crossed fused renal ectopia, Pelvic or ectopic kidney, Bilateral ureteropelvic junction obstruction of normally positioned kidneys",
     "Rule out key mimics"
    ],
    [
     "Management Strategy",
     "Manage asymptomatic incidental cases conservatively with reassurance and periodic surveillance",
     "Core treatment modality"
    ],
    [
     "Clinical Pitfall",
     "Failing to map the anomalous and often multiple vessels before surgery on the isthmus or a renal unit",
     "Prevent diagnostic or management error"
    ]
   ],
   "caption": "Overview comparison matrix for horseshoe kidney."
  }
 ],
 "diagrams": [
  {
   "id": "horseshoe-kidney-diagram",
   "title": "Horseshoe kidney: Renal & Urinary Tract Diagnostic Schematic",
   "type": "diagram",
   "src": "/assets/kb-diagrams/renal-diagram.svg?v=kbdx1",
   "caption": "Nephrological schematic demonstrating corticomedullary architecture, nephron filtration apparatus, and collecting system.",
   "annotations": [
    {
     "label": "Renal Cortex",
     "description": "Glomerular filtration rate, corticomedullary differentiation, and parenchymal depth."
    },
    {
     "label": "Tubular Apparatus",
     "description": "Proximal tubule, loop of Henle, and distal countercurrent exchange dynamics."
    },
    {
     "label": "Collecting System",
     "description": "Calyces, renal pelvis, and ureteric drainage mechanics."
    }
   ]
  }
 ]
}
