{
 "id": "mitochondrial_trifunctional_protein_deficiency",
 "name": "Mitochondrial trifunctional protein deficiency",
 "aliases": [
  "MTP deficiency",
  "TFP deficiency",
  "HADHA deficiency",
  "HADHB deficiency",
  "long-chain 3-hydroxyacyl-CoA dehydrogenase (LCHAD) deficiency"
 ],
 "class": "non_infective",
 "system": "Metabolic / Genetics",
 "specialty": "Metabolic Medicine / Clinical Genetics",
 "referenceOnly": true,
 "reference": {
  "source": "Scriver's OMMBID (Online Metabolic and Molecular Bases of Inherited Disease)",
  "sourceEdition": "current",
  "pages": null,
  "clinicalPearls": [
   "Autosomal recessive defect of the mitochondrial trifunctional protein (HADHA/HADHB genes) that carries out three steps of long-chain fatty-acid beta-oxidation; isolated LCHAD deficiency is a common subtype",
   "Presents across a spectrum from severe neonatal cardiomyopathy and hypoketotic hypoglycaemia to a milder later-onset phenotype with episodic rhabdomyolysis and a progressive peripheral neuropathy",
   "Fasting or intercurrent illness precipitates hypoketotic hypoglycaemia, liver dysfunction and metabolic decompensation",
   "LCHAD deficiency is distinctively associated with a progressive pigmentary retinopathy and peripheral neuropathy not usually seen in other fatty-acid oxidation defects",
   "Carrying an affected fetus is linked to maternal HELLP syndrome and acute fatty liver of pregnancy, so a maternal obstetric history is an important clue",
   "Blood acylcarnitines show elevated long-chain hydroxyacylcarnitines, detectable on newborn screening",
   "Management centres on avoidance of fasting, a low long-chain-fat diet with medium-chain triglyceride substitution, and prompt glucose during catabolic stress"
  ],
  "pathophysiology": "The mitochondrial trifunctional protein is a hetero-octamer of alpha (HADHA) and beta (HADHB) subunits that performs the last three enzymatic steps of long-chain fatty-acid beta-oxidation: long-chain enoyl-CoA hydratase, long-chain 3-hydroxyacyl-CoA dehydrogenase (LCHAD) and long-chain 3-ketoacyl-CoA thiolase activities. Deficiency blocks energy production from long-chain fats, so during fasting or illness tissues cannot generate adequate ATP or ketones, producing hypoketotic hypoglycaemia and accumulation of toxic long-chain hydroxyacyl intermediates. These intermediates injure the heart, skeletal muscle, liver, peripheral nerves and retina. Reduced fatty-acid oxidation in the fetus and placenta also underlies the associated maternal liver disease of pregnancy.",
  "additionalDifferentials": [
   "Very-long-chain acyl-CoA dehydrogenase (VLCAD) deficiency",
   "Carnitine palmitoyltransferase II deficiency",
   "Other long-chain fatty-acid oxidation disorders",
   "Primary dilated or hypertrophic cardiomyopathy",
   "Inherited causes of recurrent rhabdomyolysis",
   "Mitochondrial respiratory chain disorders",
   "Hereditary sensorimotor neuropathies"
  ],
  "additionalInvestigations": [
   "Plasma acylcarnitine profile showing elevated long-chain 3-hydroxyacylcarnitines",
   "Blood glucose, ketones and free fatty acids during acute episodes to demonstrate hypoketotic hypoglycaemia",
   "Creatine kinase and myoglobinuria assessment during suspected rhabdomyolysis",
   "Echocardiography and ECG to evaluate cardiomyopathy and arrhythmia",
   "Ophthalmological review and nerve conduction studies for retinopathy and neuropathy",
   "HADHA/HADHB molecular genetic testing to confirm the diagnosis"
  ],
  "redFlags": [
   "Neonatal cardiomyopathy with hypoketotic hypoglycaemia and collapse",
   "Acute rhabdomyolysis with risk of renal impairment during illness or exertion",
   "Arrhythmia or cardiac decompensation during metabolic crises",
   "Maternal HELLP syndrome or acute fatty liver of pregnancy prompting evaluation of the infant"
  ],
  "prognosis": "The severe neonatal cardiomyopathic form carries high mortality, whereas milder phenotypes may be managed with diet and fasting avoidance; however, progressive retinopathy and peripheral neuropathy can cause long-term morbidity even with good metabolic control.",
  "pitfalls": [
   "Missing hypoketotic hypoglycaemia by not measuring ketones alongside glucose",
   "Failing to consider the diagnosis in a mother with HELLP or acute fatty liver of pregnancy",
   "Overlooking the evolving retinopathy and neuropathy that distinguish LCHAD/MTP deficiency",
   "Allowing prolonged fasting or high long-chain-fat intake that precipitates decompensation"
  ],
  "references": [
   "Scriver's OMMBID: Disorders of Mitochondrial Fatty Acid Oxidation",
   "Saudubray, Baumgartner & Walter, Inborn Metabolic Diseases: Diagnosis and Treatment"
  ],
  "crossLinks": [],
  "management": [
   "Dietary therapy is the mainstay: a low long-chain-fat diet supplemented with medium-chain triglycerides that bypass the enzyme block, together with a high complex-carbohydrate intake",
   "Strict avoidance of fasting with frequent feeds and an emergency regimen of extra carbohydrate during intercurrent illness, and intravenous dextrose when oral intake fails",
   "Docosahexaenoic acid supplementation to slow the LCHAD-associated pigmentary retinopathy, with carnitine used cautiously only if deficient",
   "Prompt treatment of acute rhabdomyolysis with intravenous fluids and hydration to protect renal function",
   "Cardiac surveillance with echocardiography and ECG and heart-failure or arrhythmia treatment for the cardiomyopathic form",
   "Regular ophthalmological review for retinopathy and nerve conduction studies for peripheral neuropathy",
   "Multidisciplinary metabolic team follow-up with a specialist dietitian, autosomal recessive genetic counselling with newborn screening and family testing, and awareness of the maternal risk of HELLP and acute fatty liver of pregnancy"
  ]
 },
 "review": {
  "status": "ai_drafted",
  "reviewedBy": null,
  "reviewedAt": null,
  "clinicianApproved": false
 },
 "version": 1,
 "algorithms": [
  {
   "id": "mitochondrial_trifunctional_protein_deficiency-pathway",
   "title": "Mitochondrial trifunctional protein deficiency: Clinical Decision & Diagnostic Pathway",
   "steps": [
    {
     "step": "Clinical Presentation & High Suspicion",
     "action": "Autosomal recessive defect of the mitochondrial trifunctional protein (HADHA/HADHB genes) that carries out three steps of long-chain fatty-acid beta-oxidation; isolated LCHAD deficiency is a common subtype",
     "critical": true
    },
    {
     "step": "Triage & Emergency Warning Signs",
     "branch": "Critical Findings",
     "action": "Emergency red flag evaluation: Neonatal cardiomyopathy with hypoketotic hypoglycaemia and collapse",
     "critical": true
    },
    {
     "step": "Diagnostic Workup & Biomarkers",
     "action": "Targeted workup: Plasma acylcarnitine profile showing elevated long-chain 3-hydroxyacylcarnitines, Blood glucose, ketones and free fatty acids during acute episodes to demonstrate hypoketotic hypoglycaemia, Creatine kinase and"
    },
    {
     "step": "Targeted Clinical Management",
     "branch": "Treatment Pathway",
     "action": "Targeted management: Dietary therapy is the mainstay: a low long-chain-fat diet supplemented with medium-chain triglycerides that bypass the enzyme block, together with a high complex-carbohydrate intake"
    },
    {
     "step": "Monitoring & Critical Pitfalls",
     "action": "Clinical pitfall alert: Missing hypoketotic hypoglycaemia by not measuring ketones alongside glucose"
    }
   ],
   "caption": "Clinical pathway for the evaluation and management of mitochondrial trifunctional protein deficiency."
  }
 ],
 "tables": [
  {
   "id": "mitochondrial_trifunctional_protein_deficiency-matrix",
   "title": "Mitochondrial trifunctional protein deficiency: Clinical Features & Management Matrix",
   "headers": [
    "Clinical Domain",
    "Protocol Recommendation",
    "Operational Goal"
   ],
   "rows": [
    [
     "Diagnostic Hallmark",
     "Autosomal recessive defect of the mitochondrial trifunctional protein (HADHA/HADHB genes) that carries out three steps of",
     "Cardinal clinical findings"
    ],
    [
     "Key Investigations",
     "Plasma acylcarnitine profile showing elevated long-chain 3-hydroxyacylcarnitines, Blood glucose, ketones and free fatty acids",
     "Confirmatory diagnostic workup"
    ],
    [
     "Primary Differentials",
     "Very-long-chain acyl-CoA dehydrogenase (VLCAD) deficiency, Carnitine palmitoyltransferase II deficiency, Other long-chain",
     "Rule out key mimics"
    ],
    [
     "Management Strategy",
     "Dietary therapy is the mainstay: a low long-chain-fat diet supplemented with medium-chain triglycerides that bypass the enzyme",
     "Core treatment modality"
    ],
    [
     "Clinical Pitfall",
     "Missing hypoketotic hypoglycaemia by not measuring ketones alongside glucose",
     "Prevent diagnostic or management error"
    ]
   ],
   "caption": "Overview comparison matrix for mitochondrial trifunctional protein deficiency."
  }
 ]
}
