{
  "id": "puerperium_involution_sepsis_breastfeeding",
  "name": "Puerperium: Involution, Sepsis, Breastfeeding and Contraception Timing",
  "aliases": [
    "6 weeks involution",
    "Afterpains breastfeeding",
    "Endometritis fever tender",
    "Mastitis flucloxacillin"
  ],
  "class": "non_infective",
  "system": "Reproductive",
  "specialty": "Obstetrics and Gynaecology",
  "referenceOnly": true,
  "review": {
    "status": "ai_drafted"
  },
  "reference": {
    "source": "Sakshi Arora Obstetrics E9 + Gynecology by Ten Teachers 21st Edition (topic map; text rewritten, no verbatim copy)",
    "sourceEdition": "Topic map (2026-10-13)",
    "pages": null,
    "clinicalPearls": [
      "6 weeks finger daily",
      "Tender foul gentamicin clindamycin",
      "Mastitis nursing flucloxacillin",
      "LAM IUCD progestin safe"
    ],
    "pathophysiology": "Oxytocin suckling contracts myometrium involuting while ascending polymicrobes invade decidua fevering; milk stasis obstructs ducts culturing staph abscessing, and prolactin anovulation spaces pregnancies waning with supplementation.",
    "additionalDifferentials": [
      "Endometritis versus mastitis versus UTI by tenderness and wedge",
      "Subinvolution versus retained by lochia and fundus",
      "LAM versus IUCD versus combined by nursing and timing"
    ],
    "additionalInvestigations": [
      "Fundal height with lochia character",
      "Cultures before antibiotics",
      "Edinburgh depression screen"
    ]
  }
}
